{
  "$schema": "./encounters.schema.json",
  "formatVersion": 2,
  "contentRevision": 3,
  "minRealm": "金丹",
  "difficultyStep": 5,
  "floors": [
    {
      "floor": 1,
      "kind": "normal",
      "realmStage": "中期",
      "milestone": null
    },
    {
      "floor": 2,
      "kind": "normal",
      "realmStage": "中期",
      "milestone": null
    },
    {
      "floor": 3,
      "kind": "normal",
      "realmStage": "中期",
      "milestone": null
    },
    {
      "floor": 4,
      "kind": "normal",
      "realmStage": "中期",
      "milestone": null
    },
    {
      "floor": 5,
      "kind": "elite",
      "realmStage": "中期",
      "milestone": "C"
    },
    {
      "floor": 6,
      "kind": "normal",
      "realmStage": "中期",
      "milestone": null
    },
    {
      "floor": 7,
      "kind": "normal",
      "realmStage": "中期",
      "milestone": null
    },
    {
      "floor": 8,
      "kind": "normal",
      "realmStage": "中期",
      "milestone": null
    },
    {
      "floor": 9,
      "kind": "normal",
      "realmStage": "中期",
      "milestone": null
    },
    {
      "floor": 10,
      "kind": "boss",
      "realmStage": "中期",
      "milestone": "B"
    },
    {
      "floor": 11,
      "kind": "normal",
      "realmStage": "中期",
      "milestone": null
    },
    {
      "floor": 12,
      "kind": "normal",
      "realmStage": "中期",
      "milestone": null
    },
    {
      "floor": 13,
      "kind": "normal",
      "realmStage": "中期",
      "milestone": null
    },
    {
      "floor": 14,
      "kind": "normal",
      "realmStage": "中期",
      "milestone": null
    },
    {
      "floor": 15,
      "kind": "elite",
      "realmStage": "中期",
      "milestone": "A"
    },
    {
      "floor": 16,
      "kind": "normal",
      "realmStage": "中期",
      "milestone": null
    },
    {
      "floor": 17,
      "kind": "normal",
      "realmStage": "中期",
      "milestone": null
    },
    {
      "floor": 18,
      "kind": "normal",
      "realmStage": "中期",
      "milestone": null
    },
    {
      "floor": 19,
      "kind": "normal",
      "realmStage": "中期",
      "milestone": null
    },
    {
      "floor": 20,
      "kind": "boss",
      "realmStage": "中期",
      "milestone": "S"
    }
  ],
  "scaling": {
    "hpGrowth": 0.04,
    "outputGrowth": 0.025,
    "defenseGrowth": 0.005,
    "types": {
      "normal": {
        "hp": 1,
        "output": 1
      },
      "elite": {
        "hp": 1.55,
        "output": 1.2
      },
      "boss": {
        "hp": 2.1,
        "output": 1.3
      }
    }
  },
  "baselines": {
    "金丹": {
      "hp": 1000,
      "physicalAtk": 640,
      "magicAtk": 710,
      "physicalDef": 220,
      "magicDef": 300,
      "speed": 255,
      "hit": 170,
      "dodge": 90,
      "referencePhysicalDef": 430,
      "referenceMagicDef": 510
    },
    "元婴": {
      "hp": 1400,
      "physicalAtk": 850,
      "magicAtk": 950,
      "physicalDef": 275,
      "magicDef": 370,
      "speed": 330,
      "hit": 175,
      "dodge": 85,
      "referencePhysicalDef": 580,
      "referenceMagicDef": 690
    },
    "化神": {
      "hp": 1800,
      "physicalAtk": 1040,
      "magicAtk": 1140,
      "physicalDef": 330,
      "magicDef": 440,
      "speed": 405,
      "hit": 195,
      "dodge": 105,
      "referencePhysicalDef": 720,
      "referenceMagicDef": 860
    },
    "炼虚": {
      "hp": 2100,
      "physicalAtk": 1130,
      "magicAtk": 1280,
      "physicalDef": 360,
      "magicDef": 485,
      "speed": 480,
      "hit": 215,
      "dodge": 125,
      "referencePhysicalDef": 780,
      "referenceMagicDef": 980
    },
    "合体": {
      "hp": 2350,
      "physicalAtk": 1240,
      "magicAtk": 1420,
      "physicalDef": 390,
      "magicDef": 530,
      "speed": 555,
      "hit": 235,
      "dodge": 145,
      "referencePhysicalDef": 850,
      "referenceMagicDef": 1100
    },
    "大乘": {
      "hp": 2600,
      "physicalAtk": 1330,
      "magicAtk": 1560,
      "physicalDef": 420,
      "magicDef": 575,
      "speed": 630,
      "hit": 255,
      "dodge": 165,
      "referencePhysicalDef": 910,
      "referenceMagicDef": 1220
    },
    "渡劫": {
      "hp": 2850,
      "physicalAtk": 1420,
      "magicAtk": 1700,
      "physicalDef": 450,
      "magicDef": 620,
      "speed": 705,
      "hit": 275,
      "dodge": 185,
      "referencePhysicalDef": 970,
      "referenceMagicDef": 1340
    }
  }
}
